Location Number,Location Name,Address,City,State,Zip Code,Phone Number,Fax Number,Latitude,Longitude
VAFO,Valley Forge National Historical Park,1400 North Outer Line Drive,King of Prussia,PA,19406,,(610) 783-1060,40.095596,-75.423987
VAMA,Vanderbilt Mansion National Historic Site,"National Park Service, 4097 Albany Post Road",Hyde Park,New York,12538,,,41.77043,-73.932905
VICK,Vicksburg National Military Park,"Vicksburg National Military Park, 3201 Clay Street",Vicksburg,Mississippi,39183,(601) 636-0583 ,(601) 636-9497,32.345551,-90.855577
VIIS,Virgin Islands National Park,"Virgin Islands National Park, 1300 Cruz Bay Creek",St. John,VI,00830,(340) 776-6201 ext. 238 ,(340) 775-9592,18.34215,-64.767569
VOYA,Voyageurs National Park,"Voyageurs National Park, 360 Highway 11 East",International Falls,Minnesota,56649,,(218) 285-7407,48.6020835,-93.403716
waca,Walnut Canyon National Monument,"Superintendent, Flagstaff Area National Monuments, 6400 N. Hwy 89",Flagstaff,AZ,86004,,(928) 527-0246,35.238961,-111.570755
wapa,War in the Pacific National Historical Park,"Superintendent, 135 Murray Boulevard",Hag&aring;t&ntilde;a,Guam,96910,,,13.44645,144.786636
wefa,Weir Farm National Historic Site,"Weir Farm NHS, 735 Nod Hill Road",Wilton,CT,06897,(203) 834-1896 ,(203) 834-2421,41.2566156,-73.4562524
whis,Whiskeytown National Recreational Area,"P.O. Box 188, 14412 Kennedy Memorial Drive",Whiskeytown,CA,96095-0188 ,,(530) 246-5154,40.612879,-122.573041
WHSA,White Sands National Monument,"White Sands National Monument, PO Box 1086",Holloman AFB,NM,88330,,,32.7696209,-106.3182956
WIHO,William Howard Taft National Historic Site,"William Howard Taft National Historic Site, 2038 Auburn Ave.",Cincinnati,Ohio,45219,(513) 684-3262 ext. 201,(513) 684-3627,39.119518,-84.508156
WORI,Women's Rights National Historical Park,"Superintendent, 136 Fall Street",Seneca Falls,New York,13148,(315) 568-0024,(315) 568-2141,42.9106968,-76.8001038
wrst,Wrangell-St. Elias National Park & Preserve,"Wrangell-St. Elias National Park, PO Box 439",Copper Center,AK,99573,,(907) 822-7216,61.5614999,-143.8523096
WRBR,Wright Brothers National Memorial,"Wright Brothers National Memorial, 1401 National Park Drive",Manteo,North Carolina,27954,(252) 441-7430 ,(252) 473-2595,35.938547,-75.712322
wupa,Wupatki National Monument,"Superintendent, Flagstaff Area National Monuments, 6400 N. Hwy 89",Flagstaff,AZ,86004,,(928) 679-2349,35.238961,-111.570755
YELL,Yellowstone National Park,P.O. Box 168,Yellowstone National Park,WY,82190-0168 ,(307) 344-7381,(307) 344-2014,44.462085,-110.642441
yose,Yosemite National Park,PO Box 577,Yosemite National Park,CA,95389,(209) 372-0200,,37.7189997,-119.5571677
yuho,Yucca House National Monument,"c/o Mesa Verde National Park, P.O. Box 8",Mesa Verde,Colorado,81330,(970) 529-4465 ,(970) 529-4637,37.16748,-108.525539
yuch,Yukon Charley Rivers National Preserve,"Eagle Visitor Center, P.O. Box 167",Eagle,AK,99738,(907) 547-2233 ,(907) 547-2247,64.78943,-141.202849
ZION,Zion National Park,Zion National Park,Springdale,Utah,84767,,(435) 772-3426,37.240801,-112.941626
,,,,,,,,,
,,,,,,,,,
